{"actors_scanned":4,"total_pois":3,"pois":[{"class":"R5POIOverlapVolume","islandId":12,"x":15000,"poiSubType":3,"z":40,"y":-22000,"poiId":"R5POIOverlapVolume /Game/Maps/Main.Main:PersistentLevel.POI|I|12|P3|v100|v-200|v30|987654|OSA|4","kind":"overlap","localY":-200,"localZ":30,"osaIndex":4,"localX":100,"seed":987654},{"class":"R5POIAudioVolume","islandId":12,"x":15100,"poiSubType":3,"z":0,"y":-22100,"poiId":"R5POIAudioVolume /Game/Maps/Main.Main:PersistentLevel.Audio|I|12|P3|v10|v20|v0|987654|OSA|5","kind":"audio","localY":20,"localZ":0,"osaIndex":5,"localX":10,"seed":987654},{"class":"BP_MarkerModel_Quest_C","kind":"marker_quest","x":-8000,"poiId":"BP_MarkerModel_Quest_C /Game/Maps/Main.Main:PersistentLevel.BP_MarkerModel_Quest_C_2","z":12,"y":9000}],"kind_counts":{"marker_quest":1,"overlap":1,"audio":1},"missing_position":0,"actors_matched":3,"island_counts":{"I12":2},"class_counts":{"R5POIOverlapVolume":1,"BP_MarkerModel_Quest_C":1,"R5POIAudioVolume":1},"sub_type_counts":{"P3":2},"timestamp":1793042428}